{
  "$schema": "../cases.schema.json",
  "id": "spec-10-annotators.case-03",
  "spec_section": "10",
  "title": "an upstream two annotations share is dispatched once",
  "operation": "evaluate",
  "sdk_support": {
    "rust": "required",
    "python": "required",
    "node": "required",
    "dotnet": "optional"
  },
  "manifest_yaml": "agent_control_specification_version: 0.5.0-alpha.1\npolicies:\n  p:\n    type: rego\n    query: data.acs.verdict\nintervention_points:\n  input:\n    policy:\n      id: p\n    policy_target: $snap.input\n    annotations:\n      alpha:\n        from: $target.text\n      beta:\n        needs: [alpha]\n        from: $pi.annotations.alpha.value\n      gamma:\n        needs: [alpha]\n        from: $pi.annotations.alpha.value\nannotators:\n  alpha:\n    type: classifier\n  beta:\n    type: classifier\n  gamma:\n    type: classifier\n",
  "intervention_point": "input",
  "snapshot": {
    "input": {
      "text": "hello"
    }
  },
  "annotator_outputs": {
    "alpha": {
      "value": 1
    },
    "beta": {
      "value": 2
    },
    "gamma": {
      "value": 3
    }
  },
  "policy_response": {
    "decision": "allow"
  },
  "expected": {
    "decision": "allow",
    "annotations": {
      "alpha": {
        "value": 1
      },
      "beta": {
        "value": 2
      },
      "gamma": {
        "value": 3
      }
    },
    "annotator_order": [
      "alpha",
      "beta",
      "gamma"
    ]
  }
}
