{
  "$schema": "../cases.schema.json",
  "id": "spec-13-evidence-cap.case-03",
  "spec_section": "13.3",
  "title": "evidence under the cap passes without a warning",
  "operation": "evaluate",
  "sdk_support": {
    "rust": "required",
    "python": "required",
    "node": "required",
    "dotnet": "optional"
  },
  "manifest_yaml": "agent_control_specification_version: 0.4.0-alpha.1\npolicies:\n  p:\n    type: custom\n    adapter: fixture\nintervention_points:\n  input:\n    policy:\n      id: p\n    policy_target: $snap.input\n",
  "intervention_point": "input",
  "snapshot": {
    "input": {
      "text": "hello"
    }
  },
  "policy_response": {
    "decision": "allow",
    "reason": "verified_offline",
    "message": "allowed with a proof pointer",
    "evidence": {
      "artefact": "sha256:abababababababababababababababababababababababababababababababab",
      "verification_pointers": {
        "ptr_000": "https://example.com/pointers/000",
        "ptr_001": "https://example.com/pointers/001"
      }
    }
  },
  "expected": {
    "decision": "allow",
    "reason": "verified_offline",
    "message": "allowed with a proof pointer",
    "transformed_policy_target": null,
    "warnings": "absent"
  }
}
