{
 "$schema": "../cases.schema.json",
 "id": "spec-13-escalation.case-08",
 "spec_section": "13",
 "title": "escalation normalizes to a deny with an approval block",
 "operation": "evaluate",
 "sdk_support": {
  "rust": "required",
  "python": "required",
  "node": "required",
  "dotnet": "optional"
 },
 "manifest_yaml": "agent_control_specification_version: 0.4.0-alpha.1\npolicies:\n  p:\n    type: rego\n    query: data.acs.verdict\nintervention_points:\n  input:\n    policy:\n      id: p\n    policy_target: $snap.input\n",
 "intervention_point": "input",
 "snapshot": {
  "input": {
   "amount": 5000,
   "recipient": "external"
  }
 },
 "policy_response": {
  "decision": "escalate",
  "reason": "approval_required"
 },
 "expected": {
  "decision": "deny",
  "reason": "approval_required",
  "approval": "present"
 }
}