{
  "$schema": "../cases.schema.json",
  "id": "spec-08-intervention-points.case-04",
  "spec_section": "4",
  "title": "pre tool call dispatch projects known tool",
  "claimable": true,
  "operation": "evaluate",
  "sdk_support": {
    "rust": "required",
    "python": "required",
    "node": "required",
    "dotnet": "optional"
  },
  "manifest_yaml": "agent_control_specification_version: 0.4.0-alpha.1\npolicies:\n  p:\n    type: rego\n    query: data.acs.verdict\nintervention_points:\n  pre_tool_call:\n    tool_name_from: $snap.tool_call.name\n    policy:\n      id: p\n    policy_target: $snap.tool_call.args\ntools:\n  search:\n    type: Tool\n    clearance: internal\n    security_labels:\n      sink: retrieval\n",
  "intervention_point": "pre_tool_call",
  "snapshot": {
    "tool_call": {
      "id": "call-1",
      "name": "search",
      "args": {
        "q": "acs"
      }
    }
  },
  "policy_response": {
    "decision": "allow"
  },
  "expected": {
    "decision": "allow",
    "policy_target": {
      "q": "acs"
    },
    "tool_name": "search"
  }
}
