{
  "$schema": "../cases.schema.json",
  "id": "spec-16-legacy-effects.case-04",
  "spec_section": "16",
  "title": "dispatcher output carrying `effects` (redaction pattern) is rejected",
  "operation": "evaluate",
  "sdk_support": {
    "rust": "required",
    "python": "required",
    "node": "required",
    "dotnet": "optional"
  },
  "manifest_yaml": "agent_control_specification_version: 0.4.0-alpha.1\npolicies:\n  p:\n    type: rego\n    query: data.acs.verdict\nintervention_points:\n  input:\n    policy:\n      id: p\n    policy_target: $snap.input\n",
  "intervention_point": "input",
  "snapshot": {
    "input": {
      "text": "Email jane@example.com and john@example.org"
    }
  },
  "policy_response": {
    "decision": "warn",
    "effects": [
      {
        "type": "redact",
        "path": "$target.text",
        "pattern": "[A-Za-z0-9._%+-]+@[A-Za-z0-9.-]+\\.[A-Za-z]{2,}",
        "replacement": "[EMAIL]"
      }
    ]
  },
  "expected": {
    "decision": "deny",
    "reason": "runtime_error:policy_output_invalid",
    "transformed_policy_target": null
  }
}
