{
 "$schema": "../cases.schema.json",
 "id": "spec-04-intervention-points.case-03",
 "spec_section": "4",
 "title": "post model call dispatches and normalizes warn",
 "operation": "evaluate",
 "sdk_support": {
  "rust": "required",
  "python": "required",
  "node": "required",
  "dotnet": "optional"
 },
 "manifest_yaml": "agent_control_specification_version: 0.4.0-alpha.1\npolicies:\n  p:\n    type: rego\n    query: data.acs.verdict\nintervention_points:\n  post_model_call:\n    policy:\n      id: p\n    policy_target: $snap.model_response\n",
 "intervention_point": "post_model_call",
 "snapshot": {
  "model_response": {
   "content": "check this"
  }
 },
 "policy_response": {
  "decision": "warn",
  "reason": "model_response_warn"
 },
 "expected": {
  "decision": "allow",
  "reason": "model_response_warn",
  "policy_target": {
   "content": "check this"
  },
  "warnings": "present"
 }
}