{
  "$schema": "../cases.schema.json",
  "id": "spec-13-verdict-normalization.case-01",
  "spec_section": "13",
  "title": "invalid policy decision fails closed",
  "operation": "evaluate",
  "sdk_support": {
    "rust": "required",
    "python": "required",
    "node": "required",
    "dotnet": "optional"
  },
  "manifest_yaml": "agent_control_specification_version: 0.4.0-alpha.1\npolicies:\n  p:\n    type: rego\n    query: data.acs.verdict\nintervention_points:\n  input:\n    policy:\n      id: p\n    policy_target: $snap.input\n",
  "intervention_point": "input",
  "snapshot": {
    "input": {
      "text": "hello"
    }
  },
  "policy_response": {
    "decision": "block"
  },
  "expected": {
    "decision": "deny",
    "reason": "runtime_error:policy_output_invalid",
    "transformed_policy_target": null
  }
}
